{
  "artifact": "overall-reviews",
  "schema_version": "1.0",
  "generated_by": "overall-review",
  "paper_id": "submission-42",
  "venue_name": "OOPSLA 2026",
  "reviews": [
    { "personality_id": "academic", "personality_label": "MIT professor reviewer",
      "target": "claude-code[yolo]:anthropic:claude-opus-5",
      "summary": "The paper adds identifier-name embeddings to a static profiler and evaluates the result inside a production AOT compiler across three benchmark suites.",
      "strengths": [
        { "statement": "Deployment constraints are taken seriously — footprint and determinism are measured, not assumed.", "severity": "major", "evidence_ref": "Section 5.2" }
      ],
      "weaknesses": [
        { "statement": "No comparison against the lightweight non-ML baseline from CC 2025.", "severity": "major", "evidence_ref": "Section 6", "claim_id": "K1" },
        { "statement": "Variance across runs is never reported.", "severity": "major", "evidence_ref": "Table 2" }
      ],
      "questions": ["How many runs back each number in Table 2, and what is the variance?"],
      "scores": [
        { "field_id": "overall", "value": 3, "rationale": "Sound engineering, but the evaluation leaves the central claim under-supported." },
        { "field_id": "confidence", "value": 3 }
      ],
      "recommendation": "borderline", "confidence": "medium" },
    { "personality_id": "industry-skeptical", "personality_label": "Industry-skeptical reviewer",
      "target": "codex[high]:openai:gpt-5.6-sol",
      "summary": "A learned static profiler evaluated on three suites, reporting single-digit-percent runtime gains.",
      "weaknesses": [
        { "statement": "A 2.31% improvement is within noise for these benchmarks unless variance is shown.", "severity": "major", "claim_id": "K1" }
      ],
      "questions": ["Were the benchmarks run on a quiesced machine?"],
      "scores": [{ "field_id": "overall", "value": 2 }],
      "recommendation": "weak-reject", "confidence": "high" }
  ]
}
